Names,Addresses,Websites
Bright Horizons Family Solutions,"200 Talcott Avenue, South,Watertown, MA 02472","https://www.google.com/maps/search/?api=1&amp;query=1011+Warrenville+Road,+Suite+160+Lisle,+IL+60532"
Bright Horizons Family Solutions,"1011 Warrenville Road, Suite 160,Lisle, IL 60532","https://www.google.com/maps/search/?api=1&amp;query=2655+W.+Midway+Blvd,+Suite+330+Broomfield,+CO+80020"
Bright Horizons Family Solutions,"2655 W. Midway Blvd, Suite 330,Broomfield, CO 80020",https://www.google.com/maps/search/?api=1&amp;query=26+Whitehouse+Road+Edinburgh+EH4+6PH
Kindergarden Nederland B.V.,"2 Crown Court,Rushden Northamptonshire NN10 6BS",https://www.google.com/maps/search/?api=1&amp;query=Herengracht+244+Amsterdam+1016+BT
,"305 Great Portland Street,West Central London W1W 5DD",
,"26 Whitehouse Road,Edinburgh EH4 6PH",
,"Summerfield’s Village Centre, Dean Row Road,Wilmslow SK9 2TA",
,"Herengracht 244,Amsterdam 1016 BT",
